[
 {
  "id": "FR-LS-01",
  "normCardId": "NC-LS-01",
  "status": "formalized",
  "ruleType": "zone_exclusion",
  "zoneSemantics": "exclusion",
  "appliesTo": {
   "objectType": "landscape_intervention",
   "contextTags": [
    "instructieregel_art_7_3",
    "exclusion_unesco_werelderfgoed_hollandse_waterlinies",
    "ouk_kernkwaliteiten_bijlage_xv_gebiedsanalyses",
    "aantasten_toets_v4_per_case",
    "derde_lid_motiveringseis",
    "aantastende_activiteiten_geweigerd_v4_per_case"
   ]
  },
  "executableRef": "engine.zone.exclude_within@poc-v1",
  "formalizedBy": "norm-formalizer#deterministic-templates-v1",
  "formalizedAt": "2026-08-30",
  "zoneSelector": {
   "zoneIds": [
    "unesco_werelderfgoed_hollandse_waterlinies"
   ],
   "geometrySource": "provincial_gio_unverified",
   "selection": "within",
   "caveat": "Werkingsgebied-GIO van CVDR704250 (geldend 13-10-2025); de join-id is niet overgenomen in de geciteerde artikelttekst en de DSO Omgevingsdocumenten Downloaden API gaf HTTP 401 zonder API-key, dus geen gioJoinId citeerbaar; geometrie komt uit de agrest IMOW-open-data-alias (aliasNote in layers.json): umbrella's 'Gebied cultuurhistorische hoofdstructuur' en 'Landschap', live geverifieerd als de verenigingen van de vijf art.-7.8-gebieden respectievelijk de vijf art.-7.11-landschappen (symdiff 0,000004 / 0,0000 km2)"
  },
  "conditions": [],
  "rationale": "CORE LANDSCHAP RULE (art. 7.3). Instructieregel directing omgevingsplannen for locations within the 'Gebied UNESCO Werelderfgoed Hollandse Waterlinies' to take the outstanding universal value into account, contain preservation/strengthening rules, and contain no rules allowing activities that damage that value. Formalized as the default zone exclusion for landscape intervention (the FR-BO-01 idiom: 'bevat geen regels die activiteiten toestaan' is the non-permission family and landscape interventions are squarely inside the addressed activity space); whether a SPECIFIC intervention 'die waarde aantast' stays a per-case V4 assessment carried in the context tags — the engine applies the protective default, exactly like FR-BO-01/FR-BO-03."
 },
 {
  "id": "FR-LS-02",
  "normCardId": "NC-LS-02",
  "status": "formalized",
  "ruleType": "zone_exclusion",
  "zoneSemantics": "exclusion",
  "appliesTo": {
   "objectType": "landscape_intervention",
   "contextTags": [
    "instructieregel_art_7_3a",
    "exclusion_unesco_werelderfgoed_neder_germaanse_limes_kernzone",
    "kernkwaliteiten_bijlage_xv",
    "aantasten_toets_v4_per_case",
    "derde_lid_motiveringseis",
    "aantastende_activiteiten_geweigerd_v4_per_case"
   ]
  },
  "executableRef": "engine.zone.exclude_within@poc-v1",
  "formalizedBy": "norm-formalizer#deterministic-templates-v1",
  "formalizedAt": "2026-08-30",
  "zoneSelector": {
   "zoneIds": [
    "unesco_werelderfgoed_neder_germaanse_limes_kernzone"
   ],
   "geometrySource": "provincial_gio_unverified",
   "selection": "within",
   "caveat": "Werkingsgebied-GIO van CVDR704250 (geldend 13-10-2025); de join-id is niet overgenomen in de geciteerde artikelttekst en de DSO Omgevingsdocumenten Downloaden API gaf HTTP 401 zonder API-key, dus geen gioJoinId citeerbaar; geometrie komt uit de agrest IMOW-open-data-alias (aliasNote in layers.json): umbrella's 'Gebied cultuurhistorische hoofdstructuur' en 'Landschap', live geverifieerd als de verenigingen van de vijf art.-7.8-gebieden respectievelijk de vijf art.-7.11-landschappen (symdiff 0,000004 / 0,0000 km2)"
  },
  "conditions": [],
  "rationale": "Art. 7.3a instructieregel, structurally identical to FR-LS-01's art. 7.3 but on the Neder-Germaanse Limes kernzone designation: same lid-1b non-permission family, executed as the default zone exclusion with the aantasten-test routed to V4 per case. The kernzone covers only 0.013 km2 within the province (the Limes crosses Utrecht locally), so the exclusion is surgical."
 },
 {
  "id": "FR-LS-03",
  "normCardId": "NC-LS-03",
  "status": "formalized",
  "ruleType": "zone_conditional",
  "zoneSemantics": "conditional",
  "appliesTo": {
   "objectType": "landscape_intervention",
   "contextTags": [
    "instructieregel_art_7_4",
    "conditional_neder_germaanse_limes_bufferzone",
    "vergunningsverbod_100m2_30cm_onder_maaiveld",
    "bijstelling_op_archeologische_gegevens_lid_4",
    "kwaliteitsregels_nederlandse_archeologie_lid_5",
    "conditional_within_neder_germaanse_limes_bufferzone",
    "vergunningsverbod_zonder_omgevingsvergunning"
   ]
  },
  "executableRef": "engine.zone.within@poc-v1",
  "formalizedBy": "norm-formalizer#deterministic-templates-v1",
  "formalizedAt": "2026-08-30",
  "zoneSelector": {
   "zoneIds": [
    "unesco_werelderfgoed_neder_germaanse_limes_bufferzone"
   ],
   "geometrySource": "provincial_gio_unverified",
   "selection": "within",
   "caveat": "Werkingsgebied-GIO van CVDR704250 (geldend 13-10-2025); de join-id is niet overgenomen in de geciteerde artikelttekst en de DSO Omgevingsdocumenten Downloaden API gaf HTTP 401 zonder API-key, dus geen gioJoinId citeerbaar; geometrie komt uit de agrest IMOW-open-data-alias (aliasNote in layers.json): umbrella's 'Gebied cultuurhistorische hoofdstructuur' en 'Landschap', live geverifieerd als de verenigingen van de vijf art.-7.8-gebieden respectievelijk de vijf art.-7.11-landschappen (symdiff 0,000004 / 0,0000 km2)"
  },
  "conditions": [
   {
    "parameter": "activity_surface",
    "operator": ">=",
    "value": 100,
    "unit": "m2"
   },
   {
    "parameter": "soil_disturbance_depth",
    "operator": ">",
    "value": 30,
    "unit": "cm"
   }
  ],
  "rationale": "Art. 7.4 instructieregel, the weaker bufferzone variant: lid 1 is a preservation/strengthening duty and lid 3 prescribes that the omgevingsplan in any case contains a prohibition on executing activities of 100 m2 or more that disturb the soil to more than 30 cm below maaiveld WITHOUT an omgevingsvergunning. The thresholds are quantitative and quoted verbatim (carried as conditions, mirroring FR-W-03's threshold idiom), but the zonder-omgevingsvergunning gateway makes the rule a permit requirement rather than a refusal — a hard exclusion would misread the gateway, so the rule is a conditional marker routed to V4 (mirroring FR-MO-02's dB-threshold treatment). Lid 4's archaeology-driven adjustment of the thresholds is motivation-gated and stays in the tags."
 },
 {
  "id": "FR-LS-04",
  "normCardId": "NC-LS-04",
  "status": "formalized",
  "ruleType": "zone_conditional",
  "zoneSemantics": "conditional",
  "appliesTo": {
   "objectType": "landscape_intervention",
   "contextTags": [
    "instructieregel_art_7_9",
    "conditional_cultuurhistorische_hoofdstructuur",
    "rekening_houden_met_waarden",
    "bescherming_en_benutting",
    "waarden_bijlage_xv",
    "derde_lid_motiveringseis",
    "conditional_within_cultuurhistorische_hoofdstructuur",
    "umbrella_vijf_art_7_8_gebieden"
   ]
  },
  "executableRef": "engine.zone.within@poc-v1",
  "formalizedBy": "norm-formalizer#deterministic-templates-v1",
  "formalizedAt": "2026-08-30",
  "zoneSelector": {
   "zoneIds": [
    "gebied_cultuurhistorische_hoofdstructuur"
   ],
   "geometrySource": "provincial_gio_unverified",
   "selection": "within",
   "caveat": "Werkingsgebied-GIO van CVDR704250 (geldend 13-10-2025); de join-id is niet overgenomen in de geciteerde artikelttekst en de DSO Omgevingsdocumenten Downloaden API gaf HTTP 401 zonder API-key, dus geen gioJoinId citeerbaar; geometrie komt uit de agrest IMOW-open-data-alias (aliasNote in layers.json): umbrella's 'Gebied cultuurhistorische hoofdstructuur' en 'Landschap', live geverifieerd als de verenigingen van de vijf art.-7.8-gebieden respectievelijk de vijf art.-7.11-landschappen (symdiff 0,000004 / 0,0000 km2)"
  },
  "conditions": [],
  "rationale": "Art. 7.9 instructieregel, the take-into-account family ('houdt rekening met de waarden ... en bevat regels ter bescherming en benutting') on the CHS umbrella (the five art.-7.8 designations, live-verified union): exactly the art.-2.14/3.10 form that FR-WA-01/FR-BO-04 formalize as a conditional marker routed to V4 — the zone overlay is deterministic, the plan-quality assessment is not."
 },
 {
  "id": "FR-LS-05",
  "normCardId": "NC-LS-05",
  "status": "formalized",
  "ruleType": "zone_conditional",
  "zoneSemantics": "conditional",
  "appliesTo": {
   "objectType": "landscape_intervention",
   "contextTags": [
    "instructieregel_art_7_11a",
    "conditional_landschap_kernkwaliteiten",
    "verbod_onevenredig_aantasten_v4_per_case",
    "kernkwaliteiten_bijlage_xvi",
    "derde_lid_motiveringseis",
    "conditional_within_landschap",
    "kernkwaliteiten_bijlage_xvi_per_gebied"
   ]
  },
  "executableRef": "engine.zone.within@poc-v1",
  "formalizedBy": "norm-formalizer#deterministic-templates-v1",
  "formalizedAt": "2026-08-30",
  "zoneSelector": {
   "zoneIds": [
    "landschap"
   ],
   "geometrySource": "provincial_gio_unverified",
   "selection": "within",
   "caveat": "Werkingsgebied-GIO van CVDR704250 (geldend 13-10-2025); de join-id is niet overgenomen in de geciteerde artikelttekst en de DSO Omgevingsdocumenten Downloaden API gaf HTTP 401 zonder API-key, dus geen gioJoinId citeerbaar; geometrie komt uit de agrest IMOW-open-data-alias (aliasNote in layers.json): umbrella's 'Gebied cultuurhistorische hoofdstructuur' en 'Landschap', live geverifieerd als de verenigingen van de vijf art.-7.8-gebieden respectievelijk de vijf art.-7.11-landschappen (symdiff 0,000004 / 0,0000 km2)"
  },
  "conditions": [],